{
  "schema": "intyy.fixture/1.0",
  "id": "normal_open_form",
  "app": "kvfcu",
  "tenant": "keystone",
  "app_version": "9.2",
  "variant": "keystone",
  "location": "/main.do",
  "viewport": {
    "width": 1280,
    "height": 800
  },
  "source": {
    "run_id": "run_2026-10-01_x5zb8h8hme",
    "seq": 34
  },
  "kind": "normal",
  "missing": [
    "dom.html"
  ]
}
