{
  "schema": "intyy.fixture/1.0",
  "id": "trouble_maintenance",
  "app": "kvfcu",
  "tenant": "keystone",
  "app_version": "9.2",
  "variant": "keystone",
  "location": "/main.do",
  "viewport": {
    "width": 1280,
    "height": 800
  },
  "source": {
    "run_id": "run_2026-10-01_5jt1tkgbqg",
    "seq": 17
  },
  "kind": "trouble",
  "missing": [
    "dom.html"
  ]
}
